{
    "meta": {
        "protocol_version": "1.0.0",
        "schema_version": "1.0.0",
        "created_at": "2025-11-30T10:00:00.000Z"
    },
    "plan_id": "550e8400-e29b-41d4-a716-446655440301",
    "context_id": "550e8400-e29b-41d4-a716-446655440300",
    "title": "API Testing Plan",
    "objective": "Test REST API endpoints using curl and jq tools",
    "status": "draft",
    "steps": [
        {
            "step_id": "550e8400-e29b-41d4-a716-446655440310",
            "description": "Fetch user list from API endpoint",
            "status": "pending",
            "agent_role": "curl_executor"
        },
        {
            "step_id": "550e8400-e29b-41d4-a716-446655440311",
            "description": "Parse JSON response to extract user names",
            "status": "pending",
            "agent_role": "jq_processor",
            "dependencies": [
                "550e8400-e29b-41d4-a716-446655440310"
            ]
        },
        {
            "step_id": "550e8400-e29b-41d4-a716-446655440312",
            "description": "Analyze response structure for schema compliance",
            "status": "pending",
            "agent_role": "agent"
        },
        {
            "step_id": "550e8400-e29b-41d4-a716-446655440313",
            "description": "Fetch user details for first user",
            "status": "pending",
            "agent_role": "curl_executor",
            "dependencies": [
                "550e8400-e29b-41d4-a716-446655440311"
            ]
        },
        {
            "step_id": "550e8400-e29b-41d4-a716-446655440314",
            "description": "Extract email addresses from user details",
            "status": "pending",
            "agent_role": "jq_processor",
            "dependencies": [
                "550e8400-e29b-41d4-a716-446655440313"
            ]
        },
        {
            "step_id": "550e8400-e29b-41d4-a716-446655440315",
            "description": "Validate email format compliance",
            "status": "pending",
            "agent_role": "agent",
            "dependencies": [
                "550e8400-e29b-41d4-a716-446655440314"
            ]
        },
        {
            "step_id": "550e8400-e29b-41d4-a716-446655440316",
            "description": "Generate test report summary",
            "status": "pending",
            "agent_role": "agent",
            "dependencies": [
                "550e8400-e29b-41d4-a716-446655440315"
            ]
        },
        {
            "step_id": "550e8400-e29b-41d4-a716-446655440317",
            "description": "Archive test results",
            "status": "pending",
            "agent_role": "agent",
            "dependencies": [
                "550e8400-e29b-41d4-a716-446655440316"
            ]
        }
    ]
}