{
  "meta": {
    "protocol_version": "1.0.0",
    "schema_version": "1.0.0",
    "created_at": "2025-11-30T12:15:01.000Z"
  },
  "plan_id": "650e8400-e29b-41d4-a716-446655444001",
  "context_id": "650e8400-e29b-41d4-a716-446655444000",
  "title": "Broadcast Fan-out Plan: Query Distribution",
  "objective": "Validate MAP broadcast pattern with parallel agent responses",
  "status": "draft",
  "steps": [
    {
      "step_id": "650e8400-e29b-41d4-a716-446655444010",
      "description": "Broadcast search query to all agents",
      "status": "pending",
      "agent_role": "orchestrator",
      "order_index": 0
    },
    {
      "step_id": "650e8400-e29b-41d4-a716-446655444011",
      "description": "Search database A",
      "status": "pending",
      "agent_role": "searcher",
      "order_index": 1,
      "dependencies": [
        "650e8400-e29b-41d4-a716-446655444010"
      ]
    },
    {
      "step_id": "650e8400-e29b-41d4-a716-446655444012",
      "description": "Search database B",
      "status": "pending",
      "agent_role": "searcher",
      "order_index": 2,
      "dependencies": [
        "650e8400-e29b-41d4-a716-446655444010"
      ]
    },
    {
      "step_id": "650e8400-e29b-41d4-a716-446655444013",
      "description": "Search database C",
      "status": "pending",
      "agent_role": "searcher",
      "order_index": 3,
      "dependencies": [
        "650e8400-e29b-41d4-a716-446655444010"
      ]
    },
    {
      "step_id": "650e8400-e29b-41d4-a716-446655444014",
      "description": "Aggregate search results",
      "status": "pending",
      "agent_role": "orchestrator",
      "order_index": 4,
      "dependencies": [
        "650e8400-e29b-41d4-a716-446655444011",
        "650e8400-e29b-41d4-a716-446655444012",
        "650e8400-e29b-41d4-a716-446655444013"
      ]
    }
  ]
}
