{
  "meta": {
    "protocol_version": "1.0.0",
    "schema_version": "1.0.0",
    "created_at": "2025-11-30T12:05:01.000Z"
  },
  "plan_id": "550e8400-e29b-41d4-a716-446655442001",
  "context_id": "550e8400-e29b-41d4-a716-446655442000",
  "title": "Multi-step SA Plan with Dependencies",
  "objective": "Validate SA step evaluation and execution ordering",
  "status": "draft",
  "steps": [
    {
      "step_id": "550e8400-e29b-41d4-a716-446655442010",
      "description": "Initialize data structures",
      "status": "pending",
      "agent_role": "agent",
      "order_index": 0,
      "dependencies": []
    },
    {
      "step_id": "550e8400-e29b-41d4-a716-446655442011",
      "description": "Process configurations",
      "status": "pending",
      "agent_role": "agent",
      "order_index": 1,
      "dependencies": [
        "550e8400-e29b-41d4-a716-446655442010"
      ]
    },
    {
      "step_id": "550e8400-e29b-41d4-a716-446655442012",
      "description": "Generate report",
      "status": "pending",
      "agent_role": "agent",
      "order_index": 2,
      "dependencies": [
        "550e8400-e29b-41d4-a716-446655442011"
      ]
    },
    {
      "step_id": "550e8400-e29b-41d4-a716-446655442013",
      "description": "Validate outputs",
      "status": "pending",
      "agent_role": "agent",
      "order_index": 3,
      "dependencies": [
        "550e8400-e29b-41d4-a716-446655442012"
      ]
    }
  ]
}
