{
  "meta": {
    "protocol_version": "1.0.0",
    "schema_version": "1.0.0",
    "created_at": "2025-11-29T13:41:06.525Z"
  },
  "plan_id": "1dd75501-77a1-49f1-a1ac-243faedd19a9",
  "context_id": "7e196aa8-a1c5-4638-a883-bf839f262507",
  "title": "Test Plan",
  "objective": "Verify compatibility",
  "status": "draft",
  "steps": [
    {
      "step_id": "bc8f8c89-1849-44fc-a534-2fd8eb543e03",
      "description": "Step 1",
      "status": "pending"
    }
  ]
}