{
  "meta": {
    "protocol_version": "1.0.0",
    "schema_version": "1.0.0",
    "created_at": "2025-11-30T12:00:01.000Z"
  },
  "plan_id": "550e8400-e29b-41d4-a716-446655441001",
  "context_id": "550e8400-e29b-41d4-a716-446655441000",
  "title": "Single-step SA Plan",
  "objective": "Validate minimal SA execution with one step",
  "status": "draft",
  "steps": [
    {
      "step_id": "550e8400-e29b-41d4-a716-446655441002",
      "description": "Execute single SA step",
      "status": "pending",
      "agent_role": "agent",
      "order_index": 0
    }
  ]
}
